{
    "$schema": "http://json-schema.org/draft-07/schema#",
    "title": "EtaRequest",
    "type": "object",
    "required": [
        "device_id",
        "timestamp",
        "current_location",
        "destination"
    ],
    "properties": {
        "device_id": {
            "type": "string",
            "minLength": 1,
            "description": "Unique identifier for pilgrim device or user session."
        },
        "timestamp": {
            "type": "string",
            "pattern": "^\\d{4}-\\d{2}-\\d{2}T\\d{2}:\\d{2}:\\d{2}Z$",
            "description": "Current ISO 8601 UTC timestamp (YYYY-MM-DDTHH:MM:SSZ)."
        },
        "current_location": {
            "$ref": "#/$defs/Location",
            "description": "Current GPS coordinates of the pilgrim."
        },
        "destination": {
            "$ref": "#/$defs/Location",
            "description": "Destination temple or landmark GPS coordinates."
        },
        "crowd_density_index": {
            "type": "number",
            "minimum": 0.0,
            "maximum": 1.0,
            "default": 0.2,
            "description": "Crowd footfall congestion index from 0.0 (empty) to 1.0 (maximum gridlock)."
        },
        "is_festival": {
            "type": "boolean",
            "default": false,
            "description": "Flag indicating if a festival, mela, or special event is active."
        },
        "weather_severity": {
            "type": "number",
            "minimum": 0.0,
            "maximum": 1.0,
            "default": 0.0,
            "description": "Weather severity index from 0.0 (clear) to 1.0 (heavy rain/storm)."
        },
        "traffic_density": {
            "type": "number",
            "minimum": 0.0,
            "maximum": 1.0,
            "default": 0.0,
            "description": "Road traffic congestion index from 0.0 (free flow) to 1.0 (jammed)."
        },
        "road_closure": {
            "type": "boolean",
            "default": false,
            "description": "Flag indicating active road closure along route."
        },
        "accident_reported": {
            "type": "boolean",
            "default": false,
            "description": "Flag indicating active traffic incident along route."
        },
        "holiday": {
            "type": "boolean",
            "default": false,
            "description": "Flag indicating a public holiday or weekend peak day."
        },
        "include_queue_time": {
            "type": "boolean",
            "default": true,
            "description": "Whether to include predicted temple darshan queue wait time in total ETA."
        }
    },
    "$defs": {
        "Location": {
            "type": "object",
            "required": [
                "lat",
                "lng"
            ],
            "properties": {
                "lat": {
                    "type": "number",
                    "minimum": -90.0,
                    "maximum": 90.0,
                    "description": "Latitude angle in decimal degrees."
                },
                "lng": {
                    "type": "number",
                    "minimum": -180.0,
                    "maximum": 180.0,
                    "description": "Longitude angle in decimal degrees."
                }
            }
        }
    }
}