{
    "device_id": "pilgrim_dev_104",
    "timestamp": "2026-08-06T10:30:00Z",
    "current_location": {
        "lat": 19.9975,
        "lng": 73.7898
    },
    "destination": {
        "lat": 19.9956,
        "lng": 73.7810
    },
    "crowd_density_index": 0.65,
    "is_festival": true,
    "weather_severity": 0.2,
    "traffic_density": 0.45,
    "road_closure": false,
    "accident_reported": false,
    "holiday": false,
    "include_queue_time": true
}